{
  "$schema": "http://json-schema.org/draft-07/schema#",
  "title": "Playbook",
  "type": "object",
  "required": ["id", "name", "modules"],
  "properties": {
    "id": {"type": "string"},
    "name": {"type": "string"},
    "modules": {"type": "array", "items": {"type": "string"}},
    "tags": {"type": "array", "items": {"type": "string"}},
    "version": {"type": "string"}
  }
}
